{
  "schemaVersion": "1.0.0",
  "id": "vatra-central-station-world",
  "name": "Vatra Central Station",
  "bounds": {
    "minX": 0,
    "minY": 0,
    "maxX": 600,
    "maxY": 180
  },
  "spawns": {
    "player": {
      "x": 300,
      "y": 120,
      "elevation": 0
    },
    "courier": {
      "x": 90,
      "y": 90,
      "elevation": 0
    },
    "recipient": {
      "x": 390,
      "y": 90,
      "elevation": 0
    }
  },
  "exchange": {
    "x": 300,
    "y": 90,
    "elevation": 0
  },
  "package": {
    "x": 300,
    "y": 90,
    "elevation": 0
  },
  "extraction": {
    "x": 570,
    "y": 155,
    "elevation": 0
  }
}
